Link,Title,Location,Summary
https://kr.indeed.com/viewjob?jk=010d38b18b07b6bb,데이터 분야 경력,LG CNS 3.7 서울,"해가 뛰어난 자 - R, Python, SAS, SQL 등 활용 역량 우대사항(해당 내용 중 1개 이상) - ML/DL 경험 인력 우대 - 관련 분야 석사 이상 학위 소지자 우대 - R, Python등 데이터분석 모델링 경험..."
https://kr.indeed.com/viewjob?jk=754be9e3d78fa802,2021년 상반기 R&D 개발자 (병역특례 가능/경력 무관),네오스텍 인천 연수구,"담당업무: - 블루투스 메시 기반 위치 추적 솔루션 개발 - 상기 솔루션의 임베디드 펌웨어 개발 - C(필수), Python, Javascript 프로그래밍 언어 사용 - 기술 지원 [자격요건] 경력사항: 무관 (신입도 지원..."
https://kr.indeed.com/viewjob?jk=da5c549bf1a76ded,데이터 사이언스(데이터 모델링 및 추천 모델링),NHN 4.4 성남 판교역,"AB테스트, 결과 해석 등) - 리눅스 환경에서 머신 러닝 및 데이터 분석 관련 언어, 라이브러리( Python, R, SQL, tensorflow 등) 능숙한 활용 - 머신러닝, 추천 , 딥러닝 관련 논문을..."
https://kr.indeed.com/viewjob?jk=1e55c69312e7685f,Field Application Overlay Competence Eng...,ASML 경기도 평택,"Statistics • Sufficient knowledge to handle SW tools (MATLAB, Python, R, C#, MS office or programming language) for data..."
https://kr.indeed.com/viewjob?jk=0592fae45af22542,2021년 상반기 Python 경력,매크로액트 성남 분당구,1년이상) 학력 학력무관 성별 무관 기타 담당업무 2021년 상반기 Python 경력 채용 커리어 양식 지원 상세모집요강 접수기간/방법 지원방법... 산업 직무별(직종) 웹프로그래머 Python 응용프로그래머응용프로그래머 산업...
https://kr.indeed.com/viewjob?jk=c0c6a53781018daf,Native Korean Speaking Software QA Test...,TikTok 서울 종로3가역 • 원격 근무,"Education, Technical Skills / Knowledge) * Experience on Python, Shell * Experience in test tools/framework... Charles..."
https://kr.indeed.com/viewjob?jk=f10a132f53b6307d,Applied Data Scientist,dunnhumby 서울,"relevant subject Programming skills (Hadoop, Spark, SQL, Python) Prototyping Statistical Modelling Analytical Techniques..."
https://kr.indeed.com/viewjob?jk=8df5412c2beb197f,소프트웨어 부문,맥시멈코퍼레이션 경상남도 진주,"인원 [담당업무] ㆍ업무:위그선 관제프로그램 개발 [C/C++ 개발필수, QT framework 개발우대, Python 개발우대] [자격요건] 경력사항: 신입, 경력(연차무관) 학력사항: 학력무관 직무기술: C/C++ 0 명..."
https://kr.indeed.com/viewjob?jk=d29856ba80e4bc98,[누구랑 라라랑] (주)라라와 함께할 웹프로그래머,라라 부산,mHTML|인터넷·IT·통신·모바일·게임>웹프로그래머>JAVA|인터넷·IT·통신·모바일·게임>웹프로그래머> Python|인터넷·IT·통신·모바일·게임>웹프로그래머>HDML|인터넷·IT·통신·모바일·게임>웹프로그래머>웹개발
https://kr.indeed.com/viewjob?jk=f71d35f5dff01c45,Consultant - Identity & Security,Microsoft 4.2 대한민국,"more... following: Azure PowerShell, CLI, Visual Studio, Python, Ruby or Terraform Identity: Designing and implementing..."
https://kr.indeed.com/viewjob?jk=4bd70fb8a220d90d,[Janssen] Data Scientist,Johnson & Johnson Family of Companies 4.2 서울,"Expertise in one or more programming languages... R, Python or SAS. 7. Knowledge of relational database architecture..."
https://kr.indeed.com/viewjob?jk=2cfd15907402c5cc,DGIST 제2차 계약직 연구원 채용공고,대구경북과학기술원 대구 현풍면,천원 이내 수행 내용 Machine learning (Deep learning) 알고리즘 개발 Python/Tensorflow 프로그래밍 Matlab/simulink 모의실험 자율주행 자동차 혹은 전문 서비...
https://kr.indeed.com/viewjob?jk=c3c9f36cd3a8c314,"연구개발, it개발 신입/경력 정규직",포엔 대전 유성구,"가능)(연구원, 주임연구원급) [우대사항-IT 개발] ㆍ컴퓨터공학 ㆍ Python(numpy, pandas, scikit-learn, sympy) ㆍ... 통신·모바일·게임>웹프로그래머> Python|인터넷·IT·통신·모바일·게임..."
https://kr.indeed.com/viewjob?jk=c2f5f53dc48263eb,Machine Learning Researcher – On-device...,Qualcomm Korea YH 서울,"experiences • Algorithm implementation experiences using python with deep learning platform, e.g. PyTorch, TensorFlow..."
https://kr.indeed.com/viewjob?jk=54e0d08c99dcf507,MI(Market Intelligence)담당 마케팅 전략 경력사원,LG전자 3.8 서울 영등포구,"마케팅 전략/방향성 도출 경험 보유 4) 우대 사항 - 통계 분석 및 프로그래밍 언어 역량 보유: R, python, Java, SPSS, Tableau, etc. - 영어 능통 역량: 해외법인과 영어 화상 회의 및 현지..."
https://kr.indeed.com/viewjob?jk=b9b5a48d2121caca,Life Actuarial Analyst (Intern) - Korea,Willis Towers Watson 서울,"Familiarity with programming tool... SAS, DB2, R, Python preferred Bachelors Degree required Actuarial exam progress..."
https://kr.indeed.com/viewjob?jk=7639fede84396f4a,"하드웨어, 소프트웨어 외 신입/경력 정규직",유닉트 경기도 양주,"studio code - xcode 서버개발 * 서버 개발 ( Python 3, Django) - visual studio code - AWS EC2... 통신·모바일·게임>응용프로그래머> Python|인터넷·IT·통신·모바일·게임..."
https://kr.indeed.com/viewjob?jk=9acc17c535b42959,2021년 (신입) 전문연구요원 모집,NHN 4.4 성남 판교역,"연구 및 개발 경험 - Python/C++/Java/C# 개발 경험... 머신러닝/딥러닝/음성인식/ 음성합성 연구 및 개발 경험 - Python/C++/Java/C# 개발 경험 - 전기전자, 정보통신, 컴퓨터 관련..."
https://kr.indeed.com/viewjob?jk=cd2ef993ee5c8d3f,지스트 블록체인인터넷경제연구센터 계약직(연구원),광주과학기술원 광주 북구,록체인 개발 블록체인 하드포크 1) 4년제 대학 이상 졸업자 2) SW프로그래밍 제작 경험자 3) Python/C/Java/Go 프로그래밍 가능자 4) 팀장급은 개발 경험 10년 이상인 자 연구직 1명 우대사...
https://kr.indeed.com/viewjob?jk=e631d46f39019d13,각 분야별 인재 Pool 등록,지투알 서울,"자 - 데이터 분석 툴(Adobe Analytics 또는 Google Analytics) 유경험자 우대 - Python, R, SQL 역량 보유자 우대 - 데이터에 기반한 문제해결 능력 및 통계학적 지식 보유자 우대 업무내용..."
https://kr.indeed.com/viewjob?jk=06995d4800ce38f3,Field Application Engineer (FAE) – Korea...,LUCID Vision Labs 대한민국,debugging technique (OpenCL... Python experience is a plus). In-depth knowledge... OpenCL... Python experience is a plus...
https://kr.indeed.com/viewjob?jk=d90a0666c61d6651,Korea ODP Cloud Engineer Customer Experi...,Oracle 3.8 대한민국,"development tools Java/J2EE, HTML5, PHP, APEX , Ajax, Python, XML, LAMP stack JBoss, Tomcat, GlassFish MySQL, NoSQL (MongoDB..."
https://kr.indeed.com/viewjob?jk=68486bb7da29a05b,Application Engineer Consultant - HAV,Mentor Graphics (Korea) LLC 4.0 경기도 성남,"Proficient in scripting languages used today. (e.g., Perl, Python, various shell scripts/Makefiles, XML, JSON, etc.) Good..."
https://kr.indeed.com/viewjob?jk=9e1861e691426a98,Field AI Engineer,Graphcore 서울,"hardware acceleration technologies Experience with Python and C++... depth knowledge of computer architectures, high..."
https://kr.indeed.com/viewjob?jk=74cf47be676133ff,DGIST 미래자동차융합연구센터 계약직 연구원 및 연수연구원 공개 초빙...,대구경북과학기술원 대구 현풍면,"기술개발 우대 사항 우대사항 - S/W개발능력, C,C++, Python,Matlab 등 능숙자 - 자율주행 및 ADAS관련 프로젝트 참여경... W개발능력, C,C++, Python,Matlab 등 능숙자 - 자율주행..."
https://kr.indeed.com/viewjob?jk=f19b8cb8881146ea,DGIST-ETH 마이크로로봇연구센터 계약직 연구원 공개 초빙 공고,대구경북과학기술원 대구 현풍면,"으신 분 우대 MATLAB, Python 등을 사용한 기본적인 프로그래... ANSYS 등) 모델 개발 우대 사항 MATLAB, Python 등을 사용한 기본적인 프로그래밍 경 험자 우대 Fluorescence..."
https://kr.indeed.com/viewjob?jk=8a15326f80e07c08,Customer Operations Engineering Manager,Success Korea 대한민국,experience in C++ or Java and Python - Network monitoring and application... C++ or Java and Python - Network...
https://kr.indeed.com/viewjob?jk=54ce47c4db974112,DGIST HumanLAB(인간중심지능형시스템연구실) 연수연구원 채용 공...,대구경북과학기술원 대구 현풍면,경험자 Matlab 또는 Python 활용 능력 우수자 국가연구... 프트웨어 설계 및 구현 가능자 Matlab/Simulink 또는 Python 활용 능력 우수자 국가연구 개발(R&D)사업 참여 경험자 영어...
https://kr.indeed.com/viewjob?jk=a2b8aae664300392,신한AI 인공지능(AI) 인력,신한에이아이 서울 영등포구,"련전공 : 인공지능 / 수학 / 산업공학 / 컴퓨터공학 / 통계 관련 [우대사항] - 프로그래밍 숙련자 ( python 外 C++, Java 등) - 금융데이터 또는 시계열 데이터 기반 인공지능 모델 구축 및 운영경험 - 강화..."
https://kr.indeed.com/viewjob?jk=eeb9fe1c361f0758,정보보안 담당자,Nexon 성남 분당구,보안 이벤트 분석 또는 상관관계 이벤트 분석 능력 보유 - OS 및 네트워크 관련 기초 지식 보유 - python 등의 간단한 스크립트 작성 능력보유 - 타인과의 원활한 커뮤니케이션 자세 - 새로운 기술에 대한 적극적...
https://kr.indeed.com/viewjob?jk=cb32ed51c4e0c7ad,DGIST 동반진단의료기술융합연구실 계약직 연구원 공개 초빙 공고,대구경북과학기술원 대구 현풍면,"경험자 Matlab 또는 Python 활용 능력 우수자 C/C++... Java, Visual Basic, Python 등) 공학용 프로그래밍 활용 가능자(Matlab, Python 등) 자동차 관련 실험 연구..."
https://kr.indeed.com/viewjob?jk=fd4eb650eb6fc519,스테코 기술EGNR(공정비젼) 경력사원,스테코 천안 서북구,"경험자 .설비운영 S/W개발, 비전/영상인식 솔루션 개발 .UI설계 및 검사 알고리즘 개발 ※C/C++, Python, 할콘 library 개발 가능자 ※영상처리 & 설비 Interface 개발 가능자 ※장비업체 Vision..."
https://kr.indeed.com/viewjob?jk=bc4c4f6e75fc8a77,(주)쓰리에치솔루션 부문별 신입/경력 직원,쓰리에치솔루션 청주 흥덕구,요건] 인공지능 관련 과목을 이수하여 논문을 이해하고 구현이 가능한자 Python 프로그래밍 가능자 Tensorflow / Pytorch 이용한 프로... hyperledger 경험자 Python이나 Node.js를 이용한 WEB...
https://kr.indeed.com/viewjob?jk=3259e28d21f56288,[전문연구요원] 빅데이터 엔지니어(신입/경력),웹젠 성남 분당구,통합 과정 수료자 포함)로서 전문연구요원 신규편입/전직 대상인 분 - Python 또는 C# 프로그래밍 능력을 보유한 분 - Linux 환경에서 개발... 요원 신규편입/전직 대상인 분 - Python 또는 C# 프로그래밍 능력을...
https://kr.indeed.com/viewjob?jk=241ae1e7499c461c,Security Engineer (모의해킹/취약점 점검),Toss 서울 강남구,"그바운트 경험이 있는 분 - 해킹대회 우승 경력이 있는 분 - 다양한 플랫폼 보안 진단 경험이 있는 분 - Python, C, C++, C#, JAVA 중 프로그래밍 언어에 능숙 하신 분 # 현업 인터뷰 - 결제 산업의 미래..."
https://kr.indeed.com/viewjob?jk=de567c4b6b588c4c,NAVER IDC 서버 운영/관리(춘천),NIT Service 춘천 동면,"Web, WAS에 대한 지식과 System application 운영 경험 - Shell script, python 활용 가능 - 해외 데이터센터 인프라 구축 또는 운영 경험 - 국가보훈대상자 및 장애인은 법령에 의거 우대..."
https://kr.indeed.com/viewjob?jk=23dfc13905f7fcc0,[Search] Knowledge Base Applications (신입...,네이버 서울,"이터 수집 및 취합 - 빅데이터 기술을 이용한 데이터 분석 - 데이터 시각화 [필요기술] - Java/ Python/Scala 중 최소 1 가지이상 숙련자 - Web(HTML, JS, D3 ) [우대사항] - 대용량 데이..."
https://kr.indeed.com/viewjob?jk=e7cc2dd53f8b03b7,빅데이터 분석(머신러닝/딥러닝) 컨설턴트 정규직,디앤아이컨설팅 서울 동대문구,"석사학위자의 경우 2년 이상 경력자 ㆍ분석결과에 대한 명확한 의사소통 및 문서화 기술이 있으신 분 ㆍR, Python 등 언어를 활용한 데이터 정제, 분석, 모델링, 시각화 경험이 있으신 분 ㆍ데이터 기반 실험 및 모델을 실..."
https://kr.indeed.com/viewjob?jk=4b3017286dd4fc26,"빅데이터 전문가, 클라우드 분야 IT 전문가 취업교육",한국기술교육직업전문학교 부산 동래구,게임>빅데이터·AI(인공지능)> Python|인터넷·IT·통신·모바일·게임... 로그래머>머신러닝(ML)|인터넷·IT·통신·모바일·게임>응용프로그래머> Python|인터넷·IT·통신·모바일·게임>응용프로그래머>증강현실(AR)|인터넷...
https://kr.indeed.com/viewjob?jk=aea07d26df8ae423,Machine Learning Researcher – Audio and...,Qualcomm Korea YH 서울,experience in machine learning • Programming skill in Python or C/C++ • Experience in PyTorch (preferred) or TensorFlow...
https://kr.indeed.com/viewjob?jk=55a19c92c845685e,Developer / Designer recruit,마이뮤직테이스트 서울 논현동,"language (i.e Python, Ruby, Java, .Net... High proficiency in Python... knowledge... least one Python web framework..."
https://kr.indeed.com/viewjob?jk=74b3d3c938870be2,Data Scientist,Motion2AI 서울,"thinking to define unstructured problems - Experience with Python (pandas, numpy), R, SQL... VBA to deal... large..."
https://kr.indeed.com/viewjob?jk=b602108c31558329,리서치분야 석사이상 경력직,케이지제로인 대한민국,"티팩터 리서치 2. 펀드, 금융 및 재무데이터 분석 3. 기업재무 관련 리서치 4. 기관 컨설팅 5. R, Python을 활용한 로직 개발 자격 요건 석사이상, 경력 3년이상, 경제학, 재무금융 전공자 우대사항 CFA..."
https://kr.indeed.com/viewjob?jk=e9d6c53d8915adf6,"[Search] 파파고 머신러닝(자연어처리, 컴퓨터비전) 엔지니어 신입/...",네이버 서울,"TensorFlow, PyTorch) · Python, C++ 등의 프로그... 자격요건] · 주도적으로 문제를 찾고, 해결할 수 있는 분 · Python 등의 프로그래밍 언어를 다룰 수 있는 분 · Tensorflow..."
https://kr.indeed.com/viewjob?jk=71c47ac87bb4087e,기술 인턴 인공지능 응용 연구/개발 인턴,써로마인드로보틱스 서울 관악구,"6개월) (협의) *모집 절차: 서류 à인터뷰(오프라인) *지원 자격: 프로그래밍 언어 활용 능력: Python, C, C++ 중 1가지 이상 데이터구조, 알고리즘 과목 이수 머신러닝과 딥러닝의 기본 개념 이해 머신러닝..."
https://kr.indeed.com/viewjob?jk=c5d6000fcd662566,리서치(사회조사/마케팅/시장조사) 연구원 신입/경력 정규직,리서치앤유 서울,"PowerPoint 이용 문서작성 능숙자 SPSS, AMOS, R, Python 등 관련 툴 사용 가능자 주식회사 리서치앤유 리서치(사회조사/마케팅... 능숙자 SPSS, AMOS, R, Python 등 관련 툴 사용 가능자 1..."
https://kr.indeed.com/viewjob?jk=810816c790317a08,보안,NHN 4.4 성남 판교역,"등 개발 경력 3년 이상 - frida, ida, gdb 활용 가능 - Objective-C / Python Script 언어 개발 경험자 - 모바일 보안 솔루션 개발 경력 - Binary 난독화 / 암호화..."
https://kr.indeed.com/viewjob?jk=d4c52ba1a491a8b9,현대무벡스 경력사원 상시,현대무벡스 서울 종로구,PM>웹기획|인터넷·IT·통신·모바일·게임>웹프로그래머>JAVA|인터넷·IT·통신·모바일·게임>웹프로그래머> Python|인터넷·IT·통신·모바일·게임>네트워크·서버·보안>정보보안|인터넷·IT·통신·모바일·게임>응용프로그래머>클라우드
https://kr.indeed.com/viewjob?jk=1748baa27965fdbf,"MVP 개발 엔지니어(서버, 웹프론트) (정규직, 계약직, 프리랜서)",더테스터 대전 중구,1년 이상의 서버 개발 경험 · 아래 옵션 중 하나의 기술 스택 사용 - JAVA기반의 Spring - Python 기반의 Django - Ruby 기반의 Rails 우대사항 · 팀단위로 프로젝트를 수주해본 적 있는...
https://kr.indeed.com/viewjob?jk=d506db8d8e7637bd,[K디지털무료교육] 빅데이터분석 AI활용 디지털트랜스포메이션 교육생 (2...,한경닷컴 서울 영등포구,게임>빅데이터·AI(인공지능)> Python|인터넷·IT·통신·모바일·게임... 그래머>인공지능(AI)|인터넷·IT·통신·모바일·게임>응용프로그래머> Python|인터넷·IT·통신·모바일·게임>응용프로그래머>API|인터넷·IT·통신...
https://kr.indeed.com/viewjob?jk=d56db98820a1324c,스크립트 개발 프로그래머,Nexon 성남 분당구,"류하여 함께 도전해나갈 분들을 기다리고 있습니다. [주요업무] - JavaScript 및 기타(Lua, Python) 스크립트 엔진 연동, 프로젝트에 맞게 수정 및 최적화 - MOD-CORE 개발시 필요한 스크립팅 개발..."
https://kr.indeed.com/viewjob?jk=079e0398b7712102,Catalog Operation Associate (Process Aut...,Coupang 2.9 서울,"전산 관련 전공이거나 해당 업무 경험이 있으신 분 Scrapy Framework, Python 각종 라이브러리 등 크롤링에 필요한 Python 기반 기술에 대한 인사이트가 있으신분 데이터베이스(MongoDB, RDBMS) 에..."
https://kr.indeed.com/viewjob?jk=390d00ceeb84f2bd,인프라 엔지니어,RIDI Corp 서울,"키텍처 구성 경험이 있으신 분 Docker, ECS, K8S 등 컨테이너 기반의 서비스 운영 경험이 있으신 분 Python, Node.js, Typescript, GO 등 프로그래밍 경험이 있으신 분 우대사항 Docker..."
https://kr.indeed.com/viewjob?jk=da83ccf654e10ff8,Lead Engineer - McKinsey Digital (18-mon...,McKinsey & Company 4.3 서울,"languages/frameworks... Node.js, Go, Elixir, Java or Python Passionate about technology and excited about the impact..."
https://kr.indeed.com/viewjob?jk=2959e56e73bf958c,업무지원 시스템 운영 및 관리 담당자 경력직,우아한 형제들 서울 송파구,"지라, 컨플런스 솔루션 관리, 운영 경험 - AWS 클라우드 이해, 서버관리, 설치 운영 경험 - Java, Python, Google Apps Script 중 하나 이상 개발 가능하신 분 - 외주사, 협업 부서와 원활한..."
https://kr.indeed.com/viewjob?jk=794e209e405f4fc0,지스트 블록체인경제센터(강남소재) 계약직연구원,광주과학기술원 광주 북구,구직 명 블록체인 개발 블록체인 경제 블록체인 하드포크 1) SW프로그래밍 제작 경험자 2) Python/C/Java/Go 프로그래밍 가능자 우대사항 ① 국가보훈대상자(취업보호대상자) 및 장애인은 관련 법령...
https://kr.indeed.com/viewjob?jk=b9a9af798e9d24a5,보안 개발자 모집,넷마블 서울 구로구,"긍정적인 업무 성향 보유하신 분 - 신기술 습득과 개발을 좋아하며 동료와 함께 성장하고 싶으신 분 우대사항 - Python(django, flask)을 이용한 back-end 개발 경험 있으신 분 - javascript..."
https://kr.indeed.com/viewjob?jk=d7b1019fe6f88309,Backend Developer,KidsLoop 서울,CI / CD 파이프 라인 경험 VPC 대한 기본 이해 우대사항 Python / Java 경험 Docker / Kubernetes 경험 AWS... Experience with Python or Java Experience...
https://kr.indeed.com/viewjob?jk=3929f9c03665e38e,Credit Risk Manager,Toss 서울 강남구,"장상황 및 변화에 대한 전략적/분석적 능력을 보유하신 분 - SAS, SQL, KnowlegeSEEKER, Python, R 등 Tool사용이 가능하신 분 - 원활한 커뮤니케이션 가능하신 분 # 우대 사항 - 신용대출/신용카..."
https://kr.indeed.com/viewjob?jk=b9b358af4d75f12a,"마케팅, 웹개발 외 신입/경력 정규직",내방패밀리 서울 서초구,"있는 것이 있는 분 - Kotlin, Swift 이해도가 높은 자 - JAVA, JS, Node.JS, Python 이해도가 높은 자 - React, Vue, Angular 이해도가 높은 자 0 명 근무조건 고용형태: 정규직..."
https://kr.indeed.com/viewjob?jk=7f8dfa642aec3d26,데이터프로덕트 서비스기획 경력직,우아한 형제들 서울 송파구,"능력(windowing, left/right/cross join, CTE 등) ※ 별도 테스트 진행예정 - python, R 등을 활용한 간단한 데이터 활용능력 - 서버 혹은 클라이언트(웹/앱) 개발자 경력 - 고객향 서비스..."
https://kr.indeed.com/viewjob?jk=ea3b136c0ff59524,데이터분석가(게임어뷰징 탐지),Nexon 성남 분당구,"시스템 운영 등의 빅데이터 활용 업무경력) - 논리적이고 체계적인 문제 해결 및 커뮤니케이션 능력 - Python, Scala 등과 같은 프로그래밍언어로 데이터 분석 및 모델링 능력 (탐색적 데이터분석/ 데이터 전처리..."
https://kr.indeed.com/viewjob?jk=67503f27b0365593,인간중심 지능형 시스템 연구실 시간제 연구원,광주과학기술원 광주 북구,"우대사항 ① 국가보훈대상자(취업보호대상자) 및 장애인은 관련 법령에 의거하여 우대 ② 이외 개발언어 ( Python, C++, JAVA, MFC, QT 등) 기반 SW(앱/웹 포함) 개발 가능자 ③ 인간대상연구 경험자..."
https://kr.indeed.com/viewjob?jk=1e95ae909de993eb,Solution Sales Architect,"FireEye, Inc. 서울",Reasonable knowledge of key technologies including SIEM/SOAR/EDR/TIP Optional: Desired expertise in scripting (e.g. python)
https://kr.indeed.com/viewjob?jk=d82f4988f7cedc22,Data Analytics 분야 컨설턴트 - 글로벌 컨설팅Firm,에스에프인촌 서울,본적으로 비즈니스 문제 해결이 가능한 컨설팅 자질을 갖추고 있어야 함 - Python 등 관련 코딩 경험자 우대 3) 영어 활용 능력 우수자 우대 4... 자질을 갖추고 있어야 함 - Python 등 관련 코딩 경험자 우대 3...
https://kr.indeed.com/viewjob?jk=a6d9692dec21424c,[아이콘트롤스] 2020년 경력 직원 (기술연구소) 연구개발부문,현대산업개발 3.0 성남 분당구,"3년 이상 - 프로그램 개발( Python, Java) 능력 보유 - 대용량... 이상 -오픈소스 기반 백엔드 개발자 -Spring, node.js, python 프레임워크를 활용한 서버 개발 역량 -AWS를 활용한 개발 유경험자..."
https://kr.indeed.com/viewjob?jk=d621cbb75440764e,백엔드 개발자,뉴트리션코트 서울 강남구,"개발 - 경력 1년 ~ 8년 - Python, Node.js, C#/ASP... 및 개발 <자격요건> - 초대졸 이상 - 경력 1년 ~ 8년 - Python, Node.js, C#/ASP.Net MVC, JAVA/Spring..."
https://kr.indeed.com/viewjob?jk=15138984e56b0b7a,Cloud Infrastructure Developer,SAP 4.3 서울,Your tasks will include developing a python based scalable job execution platform... development with Python Experience...
https://kr.indeed.com/viewjob?jk=f0df38dd41b4447f,AML 데이터 분석/모델링 전문가 모집,네이버파이낸셜 성남 정자동,"합니다. 자격요건 - 대용량 데이터 분석 Skill/Tool 사용이 가능하신 분 (SAS, R, Python 등) - Anomaly Detection 관점에서의 예측 모델링 개발을 경험하신 분 [우대사항] - FDS..."
https://kr.indeed.com/viewjob?jk=7ec73f225cc61300,QA Technical Tester (파견계약직),Electronic Arts 서울,"분 Quality Assurance/Quality Engineering 업무 및 테스트 자동화에 관심이 있으신 분 Python, Powershell 등을 활용한 스크립팅 활용이 가능하신 분 (C#, C++ 을 활용 능력 우대..."
https://kr.indeed.com/viewjob?jk=80295f9d3dd93f53,삼성전자 플랫폼 SM (Front/Backend/DBA/SWA),샘소프트 서울 서초구,"능력 (Terraform, CloudFormation 활용) - Kubernetes 운영 경험 - Bash, Python, Java, Javascript등 개발 언어 사용 경험 - Kafka, MQ, Redis 운영 경험..."
https://kr.indeed.com/viewjob?jk=e745dd08a50c50e4,Data Analyst Lead,Toss 서울 강남구,"있는 분 - 통계학 및 예측 모델링 관련 석/박사 학위 소지하신 분 혹은 경험이 풍부하신 분 - Python, R, Spark 등 언어 및 데이터 프로세싱 프레임워크에 대한 이해도가 높은 분 - Data Warehouse..."
https://kr.indeed.com/viewjob?jk=ae928651c365a907,주간 보안 관제센터 관제 10년 이하,시스템 소프트웨어 개발/ 서비스 IT 서비스 기업 서울 강남구,"및 대응 (Incident Response)에 대한 경험 및 이해 필수 - 다양한 보안솔루션 운영 경험 - Python, GoLang 및 스크립트 언어 사용 가능자 • 우대사항 - ELK 기반 업무 유경험자 - 트렌드 마이..."
https://kr.indeed.com/viewjob?jk=96f799b6772a2fc8,[공통기술부문] 클라우드 엔지니어 (3년 이상),우아한 형제들 서울 송파구,"하나 이상의 퍼블릭 클라우드 아키텍처 구성 및 운영 경험이 있으신 분 - Linux 명령 및 Shell, Python 등 스크립트 개발에 익숙하신 분 - Terraform, CloudFormation 등 IaC 구축 및 운영..."
https://kr.indeed.com/viewjob?jk=e76292662d915031,Consultant - Cloud Infra,Microsoft 4.2 대한민국,"more... following: Azure PowerShell, CLI, Visual Studio, Python, Ruby or Terraform Identity: Designing and implementing..."
https://kr.indeed.com/viewjob?jk=aa3e1702724cf66c,AI 데이터 품질진단 인재,아이티지엔 서울 광진구,"AI 데이터 품질진단 [필수조건] - 학력: 학력무관 - 경력: 경력 2년 [우대조건] - JAVA, Python 등 웹개발 경험자 - JSON, XML 작업 유경험자 - 데이터 (정형, 비정형) 품질진단 유경험자 상세모집..."
