Link,Title,Location,Summary
https://kr.indeed.com/viewjob?jk=9fe4755841bec8ce,"데이터 분석 및 컨설팅 분야 (Python, SAS, 빅데이터) 경력직",한국정보기술단 과천 과천시,"데이터 분석 및 컨설팅 분야 ( Python, SAS, 빅데이터) 경력직... 대졸 이상 (학사 이상 우대) - 데이터 분석 분야 경력 2년 이상 ( Python, R, SAS 기반의 DATA Preparation, 통계, 머신러..."
https://kr.indeed.com/viewjob?jk=55584c627df1acaa,데이터 분석가/사이언티스트(신입/인턴 가능),쏘카 대한민국,"Sheet) 등 데이터 분석 도구를 원활히 다루시거나, 앞으로 원활히 다루고자 하는 의지가 높으신 분 • Python, R 등의 프로그래밍 언어 혹은 데이터 분석 언어를 1개 이상 능숙하게 사용 가능하신 분 전형절차 서류..."
https://kr.indeed.com/viewjob?jk=d0e25e778a071c50,(주)아이옵스 소프트웨어 개발자,아이옵스 대전 유성구,"트스트랩, 웹개발, C++, C#, python, java 등 1개 이상의... 대사항] - 자바스크립트, 부트스트랩, 웹개발, C++, C#, python, java 등 1개 이상의 개발환경 능숙자 - Windows, Linux..."
https://kr.indeed.com/viewjob?jk=15eb7355628c349a,EUV CS Competency Engineer,ASML 대한민국,"skills Logical / analytical thinking Data analysis (MATLAB, Python, MS Excel etc) Capable of dealing... broad range..."
https://kr.indeed.com/viewjob?jk=dfb20fa220f3c478,"빅데이터, 인공지능(AI) 외 신입/경력 인턴",스칼라웍스 대한민국,인공지능)>인공지능(AI)|인터넷·IT·통신·모바일·게임>빅데이터·AI(인공지능)>데이터분석|인터넷·IT·통신·모바일·게임>빅데이터·AI(인공지능)> Python|인터넷·IT·통신·모바일·게임>빅데이터·AI(인공지능)>딥러닝
https://kr.indeed.com/viewjob?jk=e05a4f462f4e81e3,경영지원본부 전산팀 경력사원,디비자산운용 대한민국,"및 네트워크 유지보수 가능자 4. 우대사항 - 전산 / 금융 관련 자격증 보유자 우대 - Oracle, Python, Java, Powerbuilder 프로그래밍 가능자 우대 - 운용사 / 사무관리사 / 증권사 등에서 관련..."
https://kr.indeed.com/viewjob?jk=0d207415a075d21c,Data Scientist (KOREA),No Deviation Pte Ltd 충청북도 청주,"data visualization - Experience using tools... SAS JMP, Python, Matlab, KNIME, and SIMCA - Experience with developing..."
https://kr.indeed.com/viewjob?jk=3ee73b74de360c58,Field Application YieldStar Competence E...,ASML 대한민국,"general metrology and scanner relation Tool handling(Matlab, Python, MS office....) Personal skills Strong ownership..."
https://kr.indeed.com/viewjob?jk=6aebabcddef7f514,Field Application Engineer,Nearfield Instruments 대한민국,"troubleshooting. Preferably to have coding capability (Matlab, Python...etc... data analysis, visualization, and algorithm..."
https://kr.indeed.com/viewjob?jk=89f3e10d77a126bf,Field Service Engineer,Nearfield Instruments 대한민국,"troubleshooting. Preferably to have coding capability (Matlab, Python...etc... data analysis, visualization, and algorithm..."
https://kr.indeed.com/viewjob?jk=d07aaa1def76f752,[ASML] 2021년도 각 부문별 경력사원,에이에스엠엘코리아 경기도 화성,"tools (MATLAB, Python, R, C#, MS office... scanner relation Tool handling (Matlab, Python, MS office etc) Experience More than..."
https://kr.indeed.com/viewjob?jk=b2a1f929637505ed,Field Application Fab Support Engineer,ASML 대한민국,"can be plus Knowledge to handle SW tools (MATLAB, Python, MS office and so... data analysis Understand semiconductor..."
https://kr.indeed.com/viewjob?jk=49486aa340e1db38,2021년 2월 경력사원,세메스 천안 서북구,"지표 및 성과에 대한 지식 보유하신 분 머신러닝, 데이터마이닝 기반 데이터 분석 시스템 개발 경력 Python, R, SAS 등 프로그래밍 경력 품질 (QA) 개발 단계별 목표 승인 개발 설비 시스템 Lv..."
https://kr.indeed.com/viewjob?jk=444320d2e49672dc,"Application Engineer South Korea (Physics, EE)",Zurich Instruments 대한민국,"Experience in programming languages LabVIEW, MATLAB, Python or C is a plus. Availability to travel, around 25%. Moreover, we..."
https://kr.indeed.com/viewjob?jk=c9f2f9cfc6bd0f16,2021년도 국토안전관리원 제기간제 근로자,국토안전관리원 경기도,"토목/건축) - 국토교통부 소관 연구개발사업 유경험자, 건설안전 데이터분석 경험자, 프로그램 언어(JAVA, Python 등) 사용 가능자 행정A - 계약업무(물품및용역 등) 유경력자 - 공공기관, 지자체 계약업무 유경력자..."
https://kr.indeed.com/viewjob?jk=da5d4dd560fb6f85,Data Scientist,Garrett Advancing Motion 경기도,"System/Data Integration • High level programming skills ( Python, R, Matlab, C++ or Java) • Machine Learning Algorithms..."
https://kr.indeed.com/viewjob?jk=233bbfd9781e846d,"Engr, Tech Supp 3",KLA-Tencor 대한민국,background Excel macro/code development for log analysis Python Database development for production Open to NCG (New College...
https://kr.indeed.com/viewjob?jk=3330430ae94277db,[타다]데이터 분석가/사이언티스트,쏘카 대한민국,"통계에 대한 지식 및 머신러닝에 대한 지식을 보유하고 있으며, 데이터 분석 실무 경험이 풍부하신 분 • R, Python(Pandas, Numpy, Scikit-learn) 등의 데이터 분석을 위한 언어를 1개 이상 능숙하게..."
https://kr.indeed.com/viewjob?jk=ab38178e6071aa0f,"Engr, Apps Dev 2",KLA-Tencor 대한민국,"working effectively with different cultures. Matlab/ Python experience is a plus. We offer a competitive, family friendly..."
https://kr.indeed.com/viewjob?jk=f3fcf50f5f932511,(주)바이오니아 2021년도 바이오인포메틱스 부문,바이오니아 대전 대덕구,"자격요건] -. Bioinformatics 및 관련 분야 전공 -. 생물정보 분석 경험자 및 프로그래밍 가능자( python, perl, R, Java, c++) -. 생물학 관련 DB 활용 가능자(NCBI, Ensembl..."
https://kr.indeed.com/viewjob?jk=c8bf4fa58999927f,AI 분야 경력,LG CNS 3.7 서울특별시,"이상 (AI 관련 논문 발표) ② AI/딥러닝 알고리즘 연구개발 프로젝트 경험 ③ Ubuntu Linux, Python, Tensorflow, PyTorch 사용 중상급 이상 우대사항(해당 내용 중 1개 이상) ① AI/머신..."
https://kr.indeed.com/viewjob?jk=cd40cf786e32f325,사내 및 서비스 보안 담당자 (경력),네오위즈 대한민국,"GuardDuty, WAF, VPC Flow Logs 분석 등)이 있으신 분 - 각종 스크립트 언어(Perl, Python, shell script 등)의 활용 능력을 가진 분 - 모바일 게임 앱에 대한 보안 검수 경험이..."
https://kr.indeed.com/viewjob?jk=4adac8923476d038,프랭클린템플턴투신운용 Junior Trader (Quant base 필수...,프랭클린템플턴투신 대한민국,"object-oriented programming and intermediate programming proficiency in Python, R or MATLAB, and SQL are essential. Licenses..."
https://kr.indeed.com/viewjob?jk=4cd34228af5013fd,DGIST 2019년 제1차 계약직원 공개채용 공고,대구경북과학기술원 대구 현풍면,"우수자(SPSS, R 등 통계패키지) 외국어(영어) 구사 능력 우수자 Programming(MATLAB, Python, C/C++ 등) 가능자 · 근무기간 : 2019.3.11.~2020.3.10. ※ 단, 재계약 평가에..."
https://kr.indeed.com/viewjob?jk=be95b5718905880f,AI/빅데이터/클라우드 분야 (인재 Pool),LG유플러스 3.8 서울,"Science를 위한 언어(R/ Python) 및 Tool(scikit-learn/Tensorflow 등) 능숙자 . Deep Learning Model 구현 경험자 . Java, Python등을 이용하여 분석을 위한 Data..."
https://kr.indeed.com/viewjob?jk=78f5465432356e17,Sr Systems Administrator I,Raytheon Intelligence & Space 대한민국,"Experience with Linux/Unix scripting, C++, Java, Perl, Python, Sybase... SQL. - Experience with Linux/Unix tools, YUM..."
https://kr.indeed.com/viewjob?jk=106e2372b51da4be,[이마트] 이마트 Data Scientist 경력직 모집,신세계 4.5 대한민국,Personalization 모델 고도화 개발 자격요건 ㆍ학사 이상 ㆍML/AI에 대한 이해와 활용능력 보유 ㆍ Python/R/Spark 기반 모델링 개발 경험 ㆍ중급이상 SQL skill 우대사항 ㆍ대고객 기반...
https://kr.indeed.com/viewjob?jk=7d85656bf08b8bf2,전사 생산기술분야 경력사원,LG이노텍 4.1 경기도 평택,"C++,Labview, R, Python 등 ) - AI 관련학과 전공 및 검사공정 AI 경력 3년이상 보유자 (딥러닝 모델설계/학습/배포, 딥러닝 성능 개선 ) - Python 언어와 딥러닝 프레임워크 (Tensorflow..."
https://kr.indeed.com/viewjob?jk=a746de9c7a6168ef,Healthcare Real World Data Analyst 담당자,IQVIA 서울,"HEOR 전반적인 업무 수행 Qualifications Claims Data 관련 분석 경력자 SAS / Python / R 등 통계 프로그래밍 언어 사용 가능자 통계학 전공자, 통계 및 Epidemiology 관련 석사..."
https://kr.indeed.com/viewjob?jk=0f7993638aee82bd,Machine Learning Researcher (Intern),Qualcomm Korea YH 서울,"Adversarial attacks, examples Minimum Qualifications • Python Programming • Deep learning with hands-on experience of deep..."
https://kr.indeed.com/viewjob?jk=9040dba1c8db2a5d,퀀트운용팀 (사원-대리급),신한비엔피파리바자산운용 대한민국,지식 보유자 - 투자자산운용사 자격증 소지자 우대 - CFA/CAIA/CPA 자격증 소지자 우대 - VBA/ Python 활용한 업무 가능자 우대 - 관련 전공 및 석박사 학위/금융 관련 자격증 보유자 우대 3. 전형방법...
https://kr.indeed.com/viewjob?jk=7f3e824eab01a741,[이마트] 이마트 ML Engineer 경력직 모집,신세계 4.5 대한민국,엔진 개발&운영 ㆍ온/오프 통합 실시간 개인화 모델 서비스 고도화 개발&운영 자격요건 ㆍ학사 이상 ㆍ Python/Java/Go/Kotlin 중 하나이상의 언어에 능숙한 분 ㆍ수학/통계/컴퓨터공학/산업공학 등 관련...
https://kr.indeed.com/viewjob?jk=e934bb33ef71dacb,[EY한영] 금융감사본부 Data Analytics 전문 경력직 모집,Ernst & Young 4.0 대한민국,총계정원장조정 경험자 - Python/R 등 프로그램 언어 활용 능력... PowerBI... Tableau Experience with Python/ R or other programming languages...
https://kr.indeed.com/viewjob?jk=05aa5498d84c58e1,데이터 엔지니어(신입/경력),쏘카 대한민국,"있는 분 • 데이터 분석팀 및 유관 부서와의 원활한 소통을 위한 기본적인 쿼리 작성 능력을 갖춘 분 • Python 또는 Java, Scala, C++, C# 등의 언어를 최소 1개 이상 능숙하게 사용할 수 있는 분 • 대용..."
https://kr.indeed.com/viewjob?jk=4665562997b87ff0,글로벌 소셜카지노 부문 사업PM,네오위즈 대한민국,슬롯/블랙잭 등의 카지노 게임에 대한 이해도가 있으신 분 2. SQL 사용이 익숙하신 분 3. 엑셀/R/ Python을 활용해 통계 분석이 가능하신 분 4. 영어 활용 능력이 높으신 분 * 면접 일정 안내는 서류 합격...
https://kr.indeed.com/viewjob?jk=385761a6f14de7c6,데이터분석가,RIDI Corp 서울,"데이터에 기반한 사고 능력 통계 기본 지식 및 모델링에 대한 이해와 활용 가능 데이터 처리 언어 (R, Python, Scala) 사용 경험 우대사항 리디 서비스 사용 경험 통계 모델링 또는 머신러닝 경험 데이터 시각화..."
https://kr.indeed.com/viewjob?jk=6aa5be5cfd7b0e18,"Solutions Engineer, AI and Simulations",ChilliConnect 서울,"experience in one... following languages: C#, C++, Python, or Java Experience in one... following libraries..."
https://kr.indeed.com/viewjob?jk=a6357089799f9975,Deep Learning R&D Engineer,Intel 4.1 서울,"Caffe, and MxNet Strong programming skills with C/C++ and Python Experiences on programming and testing on Linux environment..."
https://kr.indeed.com/viewjob?jk=623d7d0a12068235,[대구] 빅데이터 개발 연구원,드림아이디어소프트 대구 동구,"학력 : 대졸 이상 (2,3년) 지원자격 - 빅데이터 기반 서비스 개발에 관심있는 분 - Java 또는 R, Python 활용 가능한 분 - 적극적인 사고와 원활한 커뮤니케이션 능력을 가지신 분 우대사항 - 백엔드 서버 개발..."
https://kr.indeed.com/viewjob?jk=44b27e9dde454c6a,[고경력자의 경우 시간단축] 홈페이지 개발 및 관리 웹프로그래머,규 대한민국,그래머>웹개발|인터넷·IT·통신·모바일·게임>웹프로그래머>HDML|인터넷·IT·통신·모바일·게임>웹프로그래머> Python|인터넷·IT·통신·모바일·게임>웹프로그래머>JAVA|인터넷·IT·통신·모바일·게임>웹프로그래머>HTML...
https://kr.indeed.com/viewjob?jk=df607996134e60ff,스테코 부문별 신입 및 경력사원,스테코 천안 서북구,"알고리즘 개발 ※ C/C++ , Python , 할콘 library 개발... 데이터 처리 개발 경험 - HTML5기반 Web 시스템 개발 경험 - Python개발 경험 인사팀 인문계열 0명 ㆍ스테코 인사담당 업무 - 인사기획..."
https://kr.indeed.com/viewjob?jk=05a8e481d9859e2c,"고등광기술연구소 레이저응용시스템연구실 박사후연구원, 위촉연구원",광주과학기술원 광주 북구,"공지능 융합연구 (Matlab/ python, Labview/ FPGA... 연구/개발 2. 레이저/포토닉스-인공지능 융합연구 (Matlab/ python, Labview/ FPGA/ Raspberry Pi 등 경험자..."
https://kr.indeed.com/viewjob?jk=7e9a745cd8bdcbe3,"Design Consultant, Staff",Synopsys 대한민국,"industry DFT, MBIST, and ATPG tools •Experience scripting... Python and Tcl. Experience with Verilog or SystemVerilog RTL..."
https://kr.indeed.com/viewjob?jk=94e6b51a16f4a0f6,Perception Software Engineer - Autonomou...,NVIDIA 대한민국,work experience. Strong programming skills in C++ and python. Hands-on experience in developing algorithms for state...
https://kr.indeed.com/viewjob?jk=18f62dc644a89e0c,2021 Global Data Internship - Seoul (Kor...,Bloomberg 서울,"work experience using one or more programming language (e.g. Python, JavaScript, SQL, etc.) Prior coursework or involvement..."
https://kr.indeed.com/viewjob?jk=089931931a0474d5,소형전지사업부/기술혁신센터,삼성SDI 3.9 충청남도 천안,"천안 전공분야 - 컴퓨터/시스템 전자/전기 기계/산공 전문지식 - Java, C#, C++, Python - Oracle (PL/SQL) - Automod, VisualComponent - 통신프로그래밍 경험..."
https://kr.indeed.com/viewjob?jk=68c314d4a02b84a6,Field Application Engineer,"Quectel Wireless Solution Co,.LTD 경기도 성남","understanding of object-oriented languages Proficiency in Python/Shell and C/C++ and (Linux, Unix) OS environment Familiar..."
https://kr.indeed.com/viewjob?jk=e8a4630bec0783e8,2021 Market Data Analyst - Seoul,Bloomberg 서울,"work experience using one more programming language... Python, SQL and R Fluency in Korean and English (both spoken..."
https://kr.indeed.com/viewjob?jk=57dead75c6dee2c1,글로벌 소셜카지노 서비스 해외사업 담당자 (경력),네오위즈 대한민국,있는 분 우대사항 - 소셜 카지노 장르를 비롯해 카지노 산업 전반 대한 높은 이해도를 갖춘 분 - R과 Python 등을 활용해 통계 분석을 할 수 있는 분 - 우수한 영어 활용 능력과 글로벌 비즈니스 관련 경험이 있는 분...
https://kr.indeed.com/viewjob?jk=27ea6faf6a8516fd,퀀트 개발자 (Quant Developer),ATZ Inc. 서울,any... following languages. (C/C++/C#/ Python/Java/Node.js)* Experience with R... languages) C/C++/C#/ Python/Java R/Excel...
https://kr.indeed.com/viewjob?jk=6373005ce9ee17b0,cloud/saas개발,Success Korea 서울,"발업무 경력 3년이상 -Node.js(java-script), SpringBoot(Java), Django( Python) 실무 경험 1년 이상 (최소 1개 이상) -RDB(Oracle, MySQL, Postgres 1개 이상..."
https://kr.indeed.com/viewjob?jk=4703aab992909e94,머신러닝 엔지니어 (5년이상),Success Korea 서울,"경력 5년 이상 - 업무내용 : IDC or Cloud 환경에서 AI 서비스 설계/운영 필수사항 : - Python 중급 이상 - PyTorch, Tensorflow, Keras 중 1개 이상 사용 가능 - AI 관련 지식..."
https://kr.indeed.com/viewjob?jk=a72ab5e8773b9ad8,빅데이터 개발(3년이상 경력),에이치알 코리아 서울,"자격 - JAVA/ Python/Scala 등 활용한 데이터분석/설계/개발 역량 - DB 설계/개발 역량 - 빅데이터(Hadoop Eco) 기반 DW/DM Architecture 수립 경험 보유자 - Python, Hadoop..."
https://kr.indeed.com/viewjob?jk=74c4f418a78c820f,데이터 전문가,Success Korea 서울 삼성동,"경험 - 프로그래밍 언어 중 2가지 이상 능숙하게 사용(R, Scala, Python, Java) - 컴퓨터 사이언스 또는 통계 관련 박사학위자 우대... 능숙하게 사용(R, Scala, Python, Java) - 컴퓨터 사이언..."
https://kr.indeed.com/viewjob?jk=eebd2d2b2254371f,HANA Test Engineer,SAP 4.3 서울,"bugs Knowledge/Experience in Git or other version control, Python or other script language, SQL Knowledge/Experience in C++..."
https://kr.indeed.com/viewjob?jk=69ea511dcdc4d5e2,[ASAP] Clock SW 개발자,Success Korea 성남 판교역,"Switch ), Linux 5년 이상의 실무 경험 필수 - C언어 가능자 (5년 이상, C++, Python 도 선호) - Clock Protocol 운용 경험자 우대 5년 이상 IEEE1588 PTP / 802..."
https://kr.indeed.com/viewjob?jk=60097047695d7c71,Text 분석,Success Korea 서울,경력 9년 이상 - R， Python 등을 활용한 Text Crawling... 력서 자격요건 - 관련 분야 경력 9년 이상 - R， Python 등을 활용한 Text Crawling， Parsing， Visualization...
https://kr.indeed.com/viewjob?jk=8ca5db390266dbf6,Quant 트레이딩 부문(마감),벨에포크자산운용 서울 신사동,"거시경제 데이터 관리 3. 지원자격 및 우대사항 (1)필수사항 -투자자산운용사 보유, Python, 엑셀 VBA 사용 능력자 ( Python 패키지 : Scikit-learn, Keras, Tensorflow 활용가능) (엑셀..."
https://kr.indeed.com/viewjob?jk=d24722707c9aed56,빅데이터수집/처리,Success Korea 경기도 성남,"자격요건] - Java, Scala, Python 사용 가능한 분(택1... 첨부 양식을 반드시 사용) 자격요건 - Java, Scala, Python 사용 가능한 분(택1) - 데이터베이스, 네트워크, 분산처리에 대한..."
https://kr.indeed.com/viewjob?jk=18647b6687b43e04,게임서버 개발,Success Korea 성남 분당구,"및 배포 시스템 구축과 개선 [자격요건] - Javascript, Python, C# 등을 사용하여 API 서버 개발, 설계가 가능하신 분 (API... 격요건 - Javascript, Python, C# 등을 사용하여 API..."
https://kr.indeed.com/viewjob?jk=633275d4c482a753,IT 데이터 분석 전문가,Success Korea 서울,"광고 Targeting 알고리즘 설계 경험자 우대 - JAVA, Python, Hadoop, hive, pig, R 등 관련 지식/경험 보유자 우대... 경험자 우대 - JAVA, Python, Hadoop, hive, pig..."
https://kr.indeed.com/viewjob?jk=5e6a30865a5ba13e,서버개발자,Success Korea 성남 판교역,"유자 - 경력 : 서버 개발경력 5년이상 - Html, JSP, PHP, Python, Javascript, Node.js 등 개발언어 능숙 - 각종... Html, JSP, PHP, Python, Javascript, Node..."
https://kr.indeed.com/viewjob?jk=a979e53aa387868c,보안개발자(ASAP),Success Korea 서울 삼성동,"요건] - 보안 취약점 점검 관련 경력 5년이상 - Java, PHP, Python 등의 언어(택1)로 자동화프로그램 개발 가능한 분 - IT인프라에... 5년이상 - Java, PHP, Python 등의 언어(택1)로 자동화프로..."
https://kr.indeed.com/viewjob?jk=89d3bffd37a2487a,빅데이터 플랫폼 운영 및 분석구현,Success Korea 서울,"데이터 분석, 또는 데이터 엔지니어링 경력 5년 이상 - JAVA, Python, SQL 중 두 개 이상의 개발 언어에 대한 높은 이해 [전형절차... 경력 5년 이상 - JAVA, Python, SQL 중 두 개 이상의 개발..."
https://kr.indeed.com/viewjob?jk=736c75e6528f5bb4,보안 엔지니어,Success Korea 성남 분당구,"코드 리뷰 가능하신 분 - 보안 기술 연구 가능하신 분 - Java, Python 등 개발 언어 사용에 익숙하신 분 - 주체적으로 일을 진행하고 리드... 연구 가능하신 분 - Java, Python 등 개발 언어 사용에 익숙하신..."
https://kr.indeed.com/viewjob?jk=c4e7809eb035c7ee,웹개발팀장,Success Korea 서울 잠실역,"이스, 카산드라등) 경험자 우대 - TDD 및 스크립트 언어(Ruby, Python, Javascript) 경험자 우대 [전형절차] 실무면접(테크면... 및 스크립트 언어(Ruby, Python, Javascript) 경험자..."
https://kr.indeed.com/viewjob?jk=521e6790bfc52607,제어 엔지니어,Success Korea 성남 중원구,"중국어 등) - 언어 개발 가능자 (Visual Basic, C#, Python) - 모터 튜닝 가능자 [전형절차] 1차 면접, 2차면접... Visual Basic, C#, Python) - 모터 튜닝 가능자..."
https://kr.indeed.com/viewjob?jk=8cf3625826afa063,Data Mining 개발(3년이상 경력),에이치알 코리아 서울,"루션 지원자격 - 데이터 분석 역량 - 정형/비정형 데이터 마이닝 개발 역량 - 자연어 처리/ 검색엔진 개발 역량 보유자 우대 - 영상 마이닝 개발 경험 보유 우대 - Python, Hadoop, Spark 개발경험자 우대"
https://kr.indeed.com/viewjob?jk=bbf36187bf5002f0,서비스 개발 및 관리,Success Korea 서울,경력 1년 이상 - PHP/ Python 등 웹프로그래밍 경력자 - APM... 출서류] 이력서 경력기술서 자격요건 - 경력 1년 이상 - PHP/ Python 등 웹프로그래밍 경력자 - APM 환경에서 시스템 구축의 전반에 대한...
https://kr.indeed.com/viewjob?jk=145e4220a8244c4e,Machine Learning Engineer (추천엔지니어),Success Korea 서울,"5년 이상 (딥러닝 관련 업무수행 2년이상 필수) 필수사항 : - Python 중급 이상 - PyTorch, Tensorflow 중 1개 이상 사용... 2년이상 필수) 필수사항 : - Python 중급 이상 - PyTorch..."
https://kr.indeed.com/viewjob?jk=5548391bead30e27,Sr.Backend Developer(Fintech),Success Korea 서울,SQL 작성 및 대용량 데이터베이스 모델링 -Fintech 분야에 대한 기술 리더십과 열정 [우대사항] - Python 개발 경험 -대용량 배치 개발 및 ORM 활용 능력 -Java spring cloud 시리즈(data...
https://kr.indeed.com/viewjob?jk=9681ee519a4f870e,게임밸런스 (게임 시뮬레이터),Success Korea 성남 분당구,프로그램 개발 경력 3년 이상이신 분 (언어 불문) -Scala 혹은 Python 등 새로운 언어의 학습 의지가 있으신 분 -숫자에 대한 감각이 있으... 언어 불문) -Scala 혹은 Python 등 새로운 언어의 학습 의지가...
https://kr.indeed.com/viewjob?jk=12abe7e77fe54636,Data Scientist,Success Korea 서울 역삼동,"Package 경험 ( Python or R) : GBM, Logistic... 그래밍 언어 : SQL and Relational Database(필수), Python or R (둘 중 하나 필수) - Data 관련 프로세스 경험..."
https://kr.indeed.com/viewjob?jk=2936adf2a7318db5,웹개발자,Success Korea 서울 잠실역,"이스, 카산드라등) 경험자 우대 - TDD 및 스크립트 언어(Ruby, Python, Javascript) 경험자 우대 [전형절차] 실무면접(테크면... 및 스크립트 언어(Ruby, Python, Javascript) 경험자..."
https://kr.indeed.com/viewjob?jk=de02498698b3c239,Back-end Developer 백엔드 개발자 (JAVA),Peer 서울 강남구,"경험 사용자 인증 메커니즘에 대한 이해 및 암호화 관련 개발 경험 Python, Go, Scala, C, Java 언어 실무 경험이나 다양한 언어... 기반), Node.js, Python 사용 DB : Mysql/Maria..."
https://kr.indeed.com/viewjob?jk=e9952107e4857eaf,Machine Learning Engineer (8년이상),Success Korea 서울,"8년 이상 (딥러닝 관련 업무수행 3년이상 필수) 필수사항 : - Python 중급 이상 - PyTorch, Tensorflow 중 1개 이상 사용... 3년이상 필수) 필수사항 : - Python 중급 이상 - PyTorch..."
https://kr.indeed.com/viewjob?jk=9e3160233e816836,메신저앱 Family OS Client 개발,Success Korea 성남 분당구,FFmpeg 소스 구조를 이해하고 능숙하게 이용할 줄 아시는 분 - Python 스크립트를 능숙하게 다룰 줄 아시는 분 [전형절차] 서류전형- 실무... 능숙하게 이용할 줄 아시는 분 - Python 스크립트를 능숙하게 다룰 줄...
https://kr.indeed.com/viewjob?jk=f797a2d19667b1e6,"Senior Manager, Customer Insights (광고사업...",Coupang 2.9 서울,"커머스, 성과 마케팅 분야 경험 7년 이상 가지신 분 내외부 이해관계자와의 협상 경험이 있으신 분 SQL, Python, R 등의 데이터 마이닝 도구에 능숙하신 분 다수의 리테일 비즈니스 모델 이해 능력을 가지신 분 복잡하고..."
https://kr.indeed.com/viewjob?jk=913dea5d207616b9,게임플랫폼 Client 개발,Success Korea 경기도 성남,"scala (이외 C++, Go, Python 등)를 이용한 서버 개발... 사용) 자격요건 - Java / scala (이외 C++, Go, Python 등)를 이용한 서버 개발 경력 3년 이상 - 오픈소스 기술을 바탕..."
https://kr.indeed.com/viewjob?jk=dd44bd54e55b2ef8,SW 개발,Success Korea 서울 신논현역,"및 구현 - 빅데이타 플랫폼/ 데이타관리 [자격요건] - JAVA, Python 등 OOP(Object Oriented Programming) 언어... 국문이력서 자격요건 - JAVA, Python 등 OOP(Object..."
https://kr.indeed.com/viewjob?jk=12bca81588e3f9aa,응용프로그래머[팀장급],Success Korea 서울 성수동,"Windows Server, MS-SQL 개발 경험 [우대사항] - Python 개발 가능자 우대 [전형절차] 서류전형 > 임원면접 > 최종합격... 개발 경험 [우대사항] - Python 개발 가능자 우대 [전형절차..."
https://kr.indeed.com/viewjob?jk=aa33fe7923668df4,Back-End 개발자 (거래소),Success Korea 서울 강남구,"설계 및 기본튜닝, DB쿼리 개발 숙련자 - Gp, Java, C++, Python 등 PHP 이외의 개발언어를 능숙하게 다루는 자 - 정보처리기사... 련자 - Gp, Java, C++, Python 등 PHP 이외의 개발언어..."
