Link,Title,Location,Summary
https://kr.indeed.com/viewjob?jk=1e974ff27c6eb340,Autonomous Driving 분야 엔지니어,포티투닷 서울 강남구,"프로그래밍 기술 (C/C++, Python 등) - 이동 로봇/드론 관련... platform 개발 경험 - 뛰어난 프로그래밍 기술 (C/C++, Python) - 3D geometry, math, physics 관련 경험 및..."
https://kr.indeed.com/viewjob?jk=733c04bade808d8a,데이터 엔지니어,RIDI Corp 서울,"에서의 데이터 파이프라인 구축 및 운영 경험 GA, Tableau 등 외부 분석/시각화 도구에 대한 지식 Python, Java, Scala 중 하나 이상을 이용한 개발 경험 추가 정보 지원 서류 안내 제출서류 : 이력..."
https://kr.indeed.com/viewjob?jk=9158043e5f2cfadb,Cloud Architect,Amazon Web Services Korea LLC 서울,"e.g. Powershell, Python, Bash, Ruby, Perl... Ansible 등 구성 관리 플랫폼 경험 · Powershell, Python, Bash, Ruby, Perl 등의 스크립팅 기술 · Linux 및..."
https://kr.indeed.com/viewjob?jk=f5b0e4923baeca2f,"MD, 플랫폼 개발자",슬래디티 경기도 의정부,유통·물류·운송·운전>유통·상품기획·MD>상품MD|인터넷·IT·통신·모바일·게임>컨텐츠·사이트운영>웹사이트운영·테스터|인터넷·IT·통신·모바일·게임>웹프로그래머>JAVA|인터넷·IT·통신·모바일·게임>웹프로그래머> Python
https://kr.indeed.com/viewjob?jk=d146cfe5dea6a5fa,Cloud Solution Architect,Microsoft 4.2 서울,"programming languages: C++, C#, Java, Node.js, JSON, PHP, Perl, Python, Ruby on Rails, Pig/Hive Experience using integrated..."
https://kr.indeed.com/viewjob?jk=b966810974ac84da,"Technical Solutions Engineer, Wear OS (E...",Google 4.3 서울,"developing web applications and programming languages (e.g., Python, Go, Java, JVM Hotspot, HTTP, HTTPS). Ability to speak..."
https://kr.indeed.com/viewjob?jk=ef17560d7d3fb8f3,2020년 각 부문 신입/경력,더이앤엠 서울,"GCP, Azure) 경력 우대 ㆍASP, Node.js, Python, Go, PHP 등 ㆍWOWZA 스트리밍 솔루션 유경험자 ㆍ호스팅 업무 유경험... ㆍASP, Node.js, Python, Go, PHP 등 ㆍWOWZA..."
https://kr.indeed.com/viewjob?jk=af5683389907a8c9,백엔드 개발자 (경력),크로스앵글 서울 역삼동,"데이터 관리 (Auth0) - 블록체인 지갑 인증 (Ethereum, EOS) [자격요건] - 백엔드 & Python 실무 개발경험 3년 이상 혹은 그에 준하는 능력을 갖고 있으신 분 - 새로운 기술에 대해 호기심을 갖고..."
https://kr.indeed.com/viewjob?jk=da280e20451ce755,Integration Engineer,스트라드비젼 서울 강남구,"algorithm • (Preferred) Experience of variant script language ( Python, Shell) • (Preferred) Experience of Linux build system..."
https://kr.indeed.com/viewjob?jk=4eff6a88fdd7bb0b,데이터 분석가,스포카 서울 강남구,"주도적으로 제시하실 수 있는 분을 찾습니다. 우대 사항 1가지 이상의 프로그래밍 언어를 구사하시는 분 Python, R 등의 프로그래밍 언어를 1개 이상 능숙하게 사용 가능하신 분을 선호합니다. 데이터 웨어하우징 인프라..."
https://kr.indeed.com/viewjob?jk=419692b3ddb34768,Analytics Specialist,MightyHive 서울,"end languages ( Python, NodeJS, PHP, etc... HTML5 / CSS / JavaScript, 기타 프론트 엔드 언어 ( Python, NodeJS, PHP 등) 등 읽고 쓰는 능력 기본 혜택..."
https://kr.indeed.com/viewjob?jk=6dc47bfa91abf550,더존 ICT그룹 헬스케어솔루션 사업직군,더존비즈온 3.3 서울 중구,통신·모바일·게임>빅데이터·AI(인공지능)>딥러닝|인터넷·IT·통신·모바일·게임>빅데이터·AI(인공지능)> Python|인터넷·IT·통신·모바일·게임>빅데이터·AI(인공지능)>R|인터넷·IT·통신·모바일·게임>빅데이터·AI...
https://kr.indeed.com/viewjob?jk=80dea8b8353c3ee0,System Engineer,Toss 서울 강남구,"# 자격 요건 - Linux 환경에서 대용량 TPS 운영 경험이 있으신 분 - 스크립트 언어(shell, python, Perl, Ruby 등)를 사용하여 인프라 운영이 가능하신 분 - HTTP, TCP/IP 프로토콜에 대한..."
https://kr.indeed.com/viewjob?jk=0b05f7fff851371a,게임 런처 개발,Nexon 성남 분당구,업무소개] - 넥슨 글로벌 플랫폼의 게임 클라이언트 배포 시스템 및 어플리케이션 개발 지원자격 - C++ 혹은 Python 프로그래밍 언어 능숙자 - 비동기 및 병렬처리 프로그래밍 경험 우대사항 - Modern C++...
https://kr.indeed.com/viewjob?jk=a50fce6cc2cb57c9,자연어처리전문가 금융챗봇 만들어 갈 엔지니어,파운트 서울 충정로역,리에 필요한 알고리즘을 개발하고 Python으로 구현 및 성능 검증을 진행... Description - 자연어 처리에 필요한 알고리즘을 개발하고 Python으로 구현 및 성능 검증을 진행 - 자연어 전처리 (형태소 분석...
https://kr.indeed.com/viewjob?jk=3e23e3d0f0f52a46,[디지털워크팀] RPA(Robotic Process Automation)...,심플렉스 서울 동작구,및 활용 역량 - 문제 해결에 대한 의지 및 긍정적 마인드 - 원활한 소통 및 팀워크 역량 우대요건 - python 문법 이해 및 활용 역량 - Automation Anywhere / UiPath / AutomateOne...
https://kr.indeed.com/viewjob?jk=9fb50d6eec9e7045,인간중심 지능형 시스템 연구실 위촉연구원,광주과학기술원 광주 북구,"및 인간 대상 연구 수행) 공학 학사학위 이상 C#기반 SW개발 가능자 우대사항 ① 이외 개발언어 ( Python, C++, JAVA, MFC, QT 등) 기반 SW(앱/웹 포함) 개발 가능자 ② 인간대상연구 경험자..."
https://kr.indeed.com/viewjob?jk=e646273cb91744c6,"Pre Sales AE, Expert",Keysight Technologies 서울,"inter-region teams • Instrument programming coding skill (C#, Python) preferred Job Function Support / Service..."
https://kr.indeed.com/viewjob?jk=b78a2f2a8bc3776d,2021년 경력사월 수시(1차),케이티디에스 서울 서초구,"원버튼을 클릭 하시면 기업 홈페이지로 이동 합니다. 직무/산업 직무별(직종) 웹프로그래머JSP, JAVA, Python, ASP.NET 응용프로그래머전산전공, Windows, Unix, Linux 산업별(업종) 솔루션.ASP..."
https://kr.indeed.com/viewjob?jk=a29697c08fc49a56,함께 성장할 S/W개발자 모집합니다.,주식회사 유락 전라북도 완주,"조건 : 주 5일(40시간)근무 지원자격 : 프로그램 코딩 가능자 프로그램 언어 무관( C, C++, Python, Java 등) 담당업무 : S/W개발 담 당 자 : 김용진 010-7446-1120 yongjinin..."
https://kr.indeed.com/viewjob?jk=8525eb04feb95444,[KSTEC] 2021년 경력 사원 (SW개발자),지식시스템 성남 분당구,"개발 (SPSS, SAS, R, Python, Java 기반) 2. 기업용... 경력 3년 ~ 10년 [기술요구사항] 1. SPSS, SAS, R, Python, Java 등 데이터분석/AI개발 도구 사용 가능자 2. Java..."
https://kr.indeed.com/viewjob?jk=857aced59dd116dd,Security Developer (보안 개발자),Toss 서울 강남구,"개발 경험이 있는 분 - 보안 로그 상관분석 개발 또는 그에 준하는 분석/탐지 기술 개발 경험이 있는 분 - Python, JAVA, Go 등의 프로그래밍 언어에 능숙한 분 # 우대 사항 - 대용량 데이터 기반의 보안시스템..."
https://kr.indeed.com/viewjob?jk=04751aa927de1b32,금융IT(UI/UX개발) 인재,에셋플러스자산운용 대한민국,"및 백엔드 개발) 및 모바일 환경 확장 - UI/UX개발 유경험자 - Python기반 프레임워크,(Django등)를 이용한 웹서비스 개발 2) 자격... 보유 인재 - mysql, Python, 유경험자 (우대사항) - 영어능..."
https://kr.indeed.com/viewjob?jk=4f319862856fe9c1,"Software Engineer, Machine Learning",Google 4.3 서울,Machine Learning or AI. Programming experience in C++ and Python. Preferred qualifications: PhD or equivalent experience...
https://kr.indeed.com/viewjob?jk=711281d258d5faaa,Manager Consumer Data,한국필립모리스㈜ 서울 영등포구,"functions • Significant proficiency in SQL, R... Python • Proficient user of MS Power Pivot, Power View, Power BI..."
https://kr.indeed.com/viewjob?jk=2695294aea6dc3b6,MongoDB Engineer 모집,카카오 4.0 성남 판교역,수 있는 분 Linux/Network에 대한 기초 지식이 있는 분 우대 사항 C/C++ 또는 Python 언어를 이용한 프로그램 개발(프로젝트) 경험이 있는 분 MongoDB 트러블 슈팅 경험이 있는 분 MongoDB...
https://kr.indeed.com/viewjob?jk=403c866fc5f43cc3,DGIST 미래자동차융합연구센터 계약직 연구원 공개 초빙 공고,대구경북과학기술원 대구 현풍면,"Dataset구축기술(Annotation Tool 개발 등) 우대 사항 - S/W개발능력, C,C++, Python, Linux환경 능숙자 - 자율주행 및 ADAS관련 프로젝트 참여경력자 - Open Framework..."
https://kr.indeed.com/viewjob?jk=3d5f8e364a71247e,Software Engineer (Back-end),Streami 서울,"Experience in JavaScript, Python or Java... one of: Modern Javascript, Java, Python * Experience building and maintaining..."
https://kr.indeed.com/viewjob?jk=52f8fb3f7e662c5d,[카카오커머스] 기술직군,카카오커머스 성남 분당구,"Keras, Pytorch 등) - Python을 활용한 머신러닝/딥러닝... 이상 사용 경험이 있으신 분 - 프로그램 개발(Java, Scala, Python 등) 중급 이상 기술 보유하신 분 - 대용량 데이터에 대한 실시간..."
https://kr.indeed.com/viewjob?jk=aefe9fe982b7d1f0,2021 상반기 인공지능(AI)/머신러닝 경력사원,아프스 서울 서초구,래밍 경력 2년 이상 -컴퓨터 공학 또는 관련학과 학사 이상 -팀러닝/컴퓨터 비전 관련 논문 독해 가능 - Python 및 1종 이상의 머신러닝 프레임워크 사용가능 [우대사항] 관련분야 실무경력 또는 석사학위 보유 OpenGL...
https://kr.indeed.com/viewjob?jk=da5c549bf1a76ded,데이터 사이언스(데이터 모델링 및 추천 모델링),NHN 4.4 성남 판교역,"AB테스트, 결과 해석 등) - 리눅스 환경에서 머신 러닝 및 데이터 분석 관련 언어, 라이브러리( Python, R, SQL, tensorflow 등) 능숙한 활용 - 머신러닝, 추천 , 딥러닝 관련 논문을..."
https://kr.indeed.com/viewjob?jk=0019db89120acd75,"서버/클라이언트 Application 개발, java, 웹개발 기술연구소...",굿링크 경상남도 진주,"이언트 Java Application 개발 Java, Java script, HTML, DataBase, python framework, 웹개발 [우대사항] ㆍ전기/전자공학, 컴퓨터/시스템공학 ㆍ정보처리기사 우대 ㆍ제품 개발..."
https://kr.indeed.com/viewjob?jk=7e94b666d8fbe2d0,[개발자] 꿈 찾아드립니다. 저희와 함께하세요.,ICON 서울,C++ / Python 개발자 (우대)(1명) 이미지 프로세싱 관련 개발 경험이 있으신 분 - OpenCV 를 이용한 C++ 혹은 Python 개발에... 통신·모바일·게임>웹프로그래머> Python|인터넷·IT·통신·모바일·게임...
https://kr.indeed.com/viewjob?jk=07375dc4e800dfa9,추천 시스템 소프트웨어 엔지니어,카카오 4.0 성남 판교역,"관련 업무 경험자 우대사항 운영체제, 네트워크, 컴파일러, 데이터베이스에 대한 이해가 깊으신 분 Python, C++, GPU 프로그래밍 숙련자 대용량/실시간 서비스 개발/운영 경험이 많으신 분 ICPC/TopCoder..."
https://kr.indeed.com/viewjob?jk=dbe3257e487e5814,[AI/Lab] AI 백엔드 엔지니어 (전문연구요원 가능),버즈니 서울,"플랫폼 및 시스템 구축 이런 분을 찾습니다 주도적으로 문제를 찾고, 해결할 수 있는 능력을 보유하신 분 Python 사용 경험이 있으신 분 다음 항목 중 두 가지 이상에 해당되는 분 AWS 혹은 GCP와 같은 클라우드 플랫폼..."
https://kr.indeed.com/viewjob?jk=78e99625e5de3c95,전문연구요원 (병역특례) 수시 (AI / HW 분야),딥엑스 성남 분당구,"모델의 RTL IP 설계 및 IP 검증 가능자 - Language: Python/Perl, C/C++ [우대 조건] - ARM based SoC 설계... Linux, shell, tcl, python, perl 사용 원활..."
https://kr.indeed.com/viewjob?jk=e91a6a5eb66c641f,21년 상반기 현대오트론 경력사원 수시,현대오트론 서울,통신·모바일·게임>응용프로그래머>Linux|인터넷·IT·통신·모바일·게임>응용프로그래머>C·C++|인터넷·IT·통신·모바일·게임>응용프로그래머> Python|인터넷·IT·통신·모바일·게임>빅데이터·AI(인공지능)>자율주행
https://kr.indeed.com/viewjob?jk=1d2b22a2bcd3256f,[AI/Lab] AI 백엔드 엔지니어 (마케팅 분야),버즈니 서울,"으로 마케팅 인사이트 도출 – 보유하고 있는 빅 데이터를 활용하여 마케팅 인사이트 도출 이런 분을 찾습니다 Python 프로그래밍에 능숙하신 분 DB, 통계, 컴퓨터 기반 기술에 대한 이해를 가지신 분 이런 분은 더욱 좋습니..."
https://kr.indeed.com/viewjob?jk=649ccf047c868778,"금융 데이터 분석 엔진, 로보어드바이저 개발자",에스비씨엔 서울 영등포구,"시스템, 머신러닝, 자연어처리. 패턴분석 - 다음 언어에서 최소 한 가지 이상 능숙자: Java, C++, Python, JavaScript 우대사항 - 석사이상 컴퓨터공학 (Computer Science) 분야 또는..."
https://kr.indeed.com/viewjob?jk=e61c9e2f3acea4ad,[이마트] 이마트 Data Engineer 경력직 모집,신세계 4.5 대한민국,"ㆍ빅데이터 인프라 구축 및 운영(AWS, GCP 인프라 운영 및 모니터링) 자격요건 ㆍ학사 이상 ㆍ Python/Java/Go 중 하나이상의 언어에 능숙한 분 ㆍ해당 경력 2년차 이상 또는 이에 상응하는 업무 능력 보유..."
https://kr.indeed.com/viewjob?jk=7a8f98dc009dd0ae,(주)엘솔루 웹 개발자,㈜엘솔루 서울,Javascript / React / Python / NodeJS 개발... Stack 개발 유경험자 ㆍJavascript / React / Python / NodeJS 개발 유경험자 ㆍHTML 5 개발 가능자(필수) 1명...
https://kr.indeed.com/viewjob?jk=0e894c3561c377f6,자연어처러(NLP) 리서처/개발자,주식회사 바운티팜 서울 역삼역,논문을 읽고 이를 실제로 구현한 경험이 있으신 분 ㆍ기계학습 모델의 실제 서비스 경험이 있으신 분 ㆍ Python에 능숙하신 분 < 담당업무> ㆍ네고시에이션을 구현할 AI서비스 개발 ㆍ식자재 업계관련 Taxonomy...
https://kr.indeed.com/viewjob?jk=70fccff4d30cb6bf,NAVER IDC 서버 운영/관리(가산),NIT Service 서울 가산동,"Web, WAS에 대한 지식과 System application 운영 경험 - Shell script, python 활용 가능 - 해외 데이터센터 인프라 구축 또는 운영 경험 - 국가보훈대상자 및 장애인은 법령에 의거 우대..."
https://kr.indeed.com/viewjob?jk=65da831cb9d5a6b5,DGIST 계약직 연구원 및 일반직원 초빙 공고,대구경북과학기술원 대구 현풍면,"구축 및 생물학 데이터 분석 Tool 개발 및 유지 다양한 프로그래밍(Java, Perl, C++, Python) 우대 사항 관련 분야 석사학위 소지자 유전체, 단백체, 대사체 데이터 분석 유경험자(3년 이상..."
https://kr.indeed.com/viewjob?jk=3715424cbfe0e064,백엔드 개발자,RippleAI 서울 관악구,API 유지 보수 및 배포 - 사내 서버 관리 - 사내 코드 리뷰 / 테스트 문화 구축 < 자격요건> - Python 사용에 능숙하신 분 - Back-end 서버 개발 경력 3년 이상 또는 그에 준하는 경험이 있으신 분...
https://kr.indeed.com/viewjob?jk=3fbbb0a082dd1ff9,"네모파트너즈비에이 데이터 분석가 신입,경력",네모파트너즈비에이 서울 영등포구,"차무관) 학력사항: 대학교(4년)졸업 직무기술: 빅데이터, 데이터분석, Python, SAS, 시스템개발, 빅데이터분석 및 AI개발 기타: - 컴퓨터... 게임>빅데이터·AI(인공지능)> Python|인터넷·IT·통신·모바일·게임..."
https://kr.indeed.com/viewjob?jk=092d062a6faa7139,데이터 분석가 모집,카카오 4.0 성남 판교역,"이터 분석 지원자격 데이터 분석 업무를 수행할 수 있는 하나 이상의 언어 스킬 필수 (예. SQL, Python, R 등) 데이터 기반 프로젝트 경험이 있으신 분 (예: 통계 분석 프로젝트) 어떤 일이라도 중요하게 여기..."
https://kr.indeed.com/viewjob?jk=71b1f763acccd622,2021년 수시채용-R&D-머신러닝 및 응용소프트웨어개발,에스에프에이 경기도 화성,"력자 -C++,C#(.NET), Python, Javascript 중 1... 영상처리-머신러닝-통계·수학 관련 분야 석사 학위 이상 졸업자 - Python, C++, C# 중 1개 이상 중급 수준 가능자 -일반지원자, 전문연..."
https://kr.indeed.com/viewjob?jk=7d4bc2a107c6669b,Customer Engineer,Microsoft 4.2 서울,least 5 years welcome experience in model development using python or R. Experience in migrating from one database to another...
https://kr.indeed.com/viewjob?jk=db55ee61f98e6816,DGIST 동반진단의료기술융합연구실 계약직 연구원 채용 공고,대구경북과학기술원 대구 현풍면,데이터 통계 분석 AI 기반 데이터 분석을 위한 대용량 고속 데이터 처리 DB 구축 우대 사항 Python/Jave 기반 생체 정보 데이터 분석 경험자 대용량 고속 데이터 처리 DB 구축 경험자 급여수준...
https://kr.indeed.com/viewjob?jk=a4e8e1be8cfd92f4,데이터분석팀 일반연구원(계약직) 채용,동국대학교 4.3 서울 필동,"자 4) 남자의 경우 병역필 또는 면제자 5) 한글, MS OFFICE 등 기본 문서작업 가능자 6) Python, R 프로그래밍 언어 사용 가능자 우대 2. 모집인원 : 0명 3. 근무조건 및 계약기간 구 분..."
https://kr.indeed.com/viewjob?jk=4bf6ecd593abdb6f,2021년 상반기(주)노르마 신입/경력,노르마 서울 성동구,"모의해킹 무관 지원자격 - 취약점 분석 경험자 우대사항 - 언어(C, Python등)에 대한 이해 및 활용 능력 - 리버스엔지니어링(arm/mips... 지원자격 - 프로그램 언어(C, Python등) 활용 가능자 - Linux..."
https://kr.indeed.com/viewjob?jk=7cb5c3076d1701db,"Field Applications Engineer, Audio",Dolby 서울,"High level or detailed knowledge of SOC design. C/C++, python coding skills. Knowledge of music, audio/video production..."
https://kr.indeed.com/viewjob?jk=3e80435be74cd28f,블록체인인터넷경제연구센터 위촉연구원,광주과학기술원 광주 북구,업무) 지원자격 연구직 O명 블록체인 연구 및 프로그래밍 제작 1) SW프로그래밍 제작 경험자 2) Python/C/Java/Go 프로그래밍 가능자 3) 블록체인 개발 경험자 우대 4) 컴퓨터공학 및 컴퓨터사이...
https://kr.indeed.com/viewjob?jk=5d4ef5faadd96b30,"[대성] 개발자 채용 | 앱개발,Java,Python,objective",대성 관심기업 전주 팔복동,"근무조건 정규직 급여 면접후 결정 주 5일 | 오전 9시~오후 6시 전북 전북전체, 전북 전주시 지원자격 신입, 경력 무관, 경력무관 학력무관 우대조건 해당업무 인턴경험, 해당업무 근무경험, 컴퓨터활용 우수자, 차량소지..."
https://kr.indeed.com/viewjob?jk=b8c6ad4bd3f32e3d,AI 개발자,넷아이디 서울 강남구,인터넷·IT·통신·모바일·게임>응용프로그래머>머신러닝(ML)|인터넷·IT·통신·모바일·게임>응용프로그래머> Python|인터넷·IT·통신·모바일·게임>ERP·시스템분석·설계>인공지능(AI)서비스기획|인터넷·IT·통신·모바일...
https://kr.indeed.com/viewjob?jk=5a349ecd72559c9f,시스템엔지니어 신입/경력 정규직,메에먼트 서울 강남구,"Virtual private cloud 를 통한 폐쇄망 구축 경험 *자동화 script ( bash, python, golang등) 개발운영 경험 우대사항 *다양한 트러블 슈팅 경험 (장애 프로파일링) *대용량 트래픽 분산처..."
https://kr.indeed.com/viewjob?jk=69ab0f58743cb713,21년 전문연구요원 (AI엔지니어),Nexon 성남 분당구,"대상자 - 병역의무가 없거나 면제된 분, 병역의 의무를 마치신 분은 본 공고의 대상에서 제외됨 - Python에 숙련된 프로그래밍 능력과 머신러닝 라이브러리 활용 경험 - 머신러닝과 강화학습에 관련된 지식 습득 혹은..."
https://kr.indeed.com/viewjob?jk=661a80939b1acd30,Solutions Engineer,f5 서울,"Kubernetes) • Proficient in one or more programming languages ( Python, JavaScript, Golang, etc.) What you’ll bring: • 5 +..."
https://kr.indeed.com/viewjob?jk=8becbf73bbda7c96,2019 Military Service Exemption Position...,울산과학기술원 울산 언양읍,"least one programming language... Fortran, C/C++, Python, …; Experience... managing high performance computational..."
https://kr.indeed.com/viewjob?jk=98c2229e57d4ee1f,전기전자컴퓨터공학부(바이오컴퓨팅연구실) 위촉연구원,광주과학기술원 광주 북구,"국가보훈대상자(취업보호대상자) 및 장애인은 관련 법령에 의거하여 우대 ② 컴퓨터 프로그램밍 (Matlab, Python, C++등) 가능자 ③ 뇌파 측정 및 분석 2년 이상 경력 ➃ 딥러닝 기술 개발 경험 결격사유..."
https://kr.indeed.com/viewjob?jk=774afc35e3ec6e5a,[AI/Lab] Recommender System 리서치 엔지니어,버즈니 서울,"Information Retrieval, Machine Learning 에 대한 기본 지식을 보유하신 분 Python 사용 능력이 능숙하신 분 논문을 정확하게 이해하고 구현할 수 있으신 분 이런 분은 더욱 좋습니다 대용량..."
https://kr.indeed.com/viewjob?jk=776ccceeaf6fe02e,DGIST 동반진단의료기술융합연구실 계약직 연구원 공개 채용 공고,대구경북과학기술원 대구 현풍면,"경험자 Matlab 또는 Python 활용 능력 우수자 C/C++... 분석 수행 Python을 통한 Data 처리 및 DB 구축 윈도우/리눅스 환경 프로그래밍 가능자(C++, Java, Python 등) 자동..."
https://kr.indeed.com/viewjob?jk=0923578a7e4eb9d2,배달로봇 dilly 로봇 소프트웨어 개발자(자율주행) (5년이상),우아한 형제들 서울 송파구,"ROS2) 기반의 이동로봇 개발 경험이 있는 분 - 컴퓨터 비전, 머신러닝 경험이 있는 분 - C/C++, Python 활용이 가능한 분 - 영어문서작성 및 회화 능력을 갖춘 분 - 다양한 직군과의 원활한 협업 및 의사소통..."
https://kr.indeed.com/viewjob?jk=7c19ff88836f8869,고등광기술연구소 전문연구요원,광주과학기술원 광주 북구,"고출력 펄스형/극초단 광섬유 레이저, 레이저/고암섬유 레이저, 레이저 인공지능 융합연구, matlab/ python/ FPGA / Raspberry Pi 등 (경험자 우대) 우대사항 ① 국가보훈대상자(취업보호대상자) 및..."
https://kr.indeed.com/viewjob?jk=aac8e9355cb855ac,[인재풀] 아티스트,Electronic Arts 서울,Maya or 3D Max등의 아트웍 툴 사용 경험 Max script 또는 Mel Script의 사용 경험 C# 또는 Python 언어에 대한 이해 및 활용 능력 아트웍 관련 툴 제작 또는 플러그인 제작 경험
https://kr.indeed.com/viewjob?jk=194bbf20319d9f24,"Systems Engineer, Ground Truth Automatio...",NVIDIA 서울,"deep understanding of programming languages in C, C++, and Python. Experienced in developing system software mostly in user..."
https://kr.indeed.com/viewjob?jk=df21e3bb5d773616,Python Programmer,Mofac 서울 서초구,개발 – JAVA 프로그래밍(라이브러리 활용) – Spring 프레임 워크 개발 – Python API 프로그래밍 우대사항 – Python 개발 경험 – Open Source 라이브러리 개발경험 – Web 표준에 대한 경험...
https://kr.indeed.com/viewjob?jk=2b2dcd3ffe3d53df,카카오 데이터의 가치를 발굴할 데이터 분석가 모집,카카오 4.0 성남 판교역,"기술 통계량 이해 및 해석) 데이터 분석 업무를 수행할 수 있는 언어 스킬 필수 SQL 필수 R 또는 Python을 다룰 수 있는 분 (SAS, SPSS, GA, tableau 등 통계 툴만 사용 가능한 경우 제외) 하둡..."
https://kr.indeed.com/viewjob?jk=7af6301dc691d3ab,Data Scientist,Toss 서울 강남구,"실무 경험 5년 이상 갖추신 분 - 실제 서비스 데이터를 이용한 분석모델 개발 경험이 있으신 분 - R, Python, Scala, SQL 등 데이터 분석의 업무를 수행할 수 있는 하나 이상의 개발 언어에 능숙하신 분 #..."
https://kr.indeed.com/viewjob?jk=46975ee759c13b8a,데이터 분석/처리 플랫폼 개발,NHN 4.4 성남 판교역,"데이터 수집, 처리 및 지표 분석 경험 - 데이터 기반의 문제해결 역량 및 논리적 사고 - Java, Python, Scala 중 최소 1가지 언어를 이용한 데이터 분석 및 소프트웨어 개발 역량 - 통계분석..."
https://kr.indeed.com/viewjob?jk=99fff6b8c3d20d8b,국내 메이저 건설사 건설업 로보틱스/자율주행 전문 개발 포지션 ASAP,국내 메이저 건설사 건설업 로보틱스/자율주행 전문 개발 포지션 ASAP 서울 종로구,"유자 - LIDAR, Vision 센싱 프로그램 활용 가능자 • 우대사항 - 컴퓨터 프로그래밍 가능자 ( Python, C++, C# 등) - ROS 프로그래밍/Manipulation PJT 경험자 근무 형태: 정규직..."
https://kr.indeed.com/viewjob?jk=96688eea9c1a9e28,Security Engineer (취약점 분석),Toss 서울 강남구,"# 자격 요건 - 모의해킹 및 취약점 점검 경력이 있는 분 - 소스 코드 정적 취약점 점검에 능숙한 분 - Python, C, C++, JAVA 중 프로그래밍 언어에 능숙한 분 # 우대 사항 - 국내 또는 국외 버그 바운티..."
https://kr.indeed.com/viewjob?jk=449c79ff66c3925c,Sydney Based Cloud Support Engineer,Success Korea 대한민국,MySQL/PostgresSQL/MSSQL/Oracle 관련 경험 · Python/Java/Shell/Perl/Ruby/PHP 등 개발/스크립트 언어... Oracle 관련 경험 · Python/Java/Shell/Perl...
